{
  "schema_version": "1.0.0",
  "dataset_version": "pvpoke-2026-07-26-5e1e3d971369",
  "classification": "Verified community data",
  "source": {
    "name": "PvPoke",
    "repository": "pvpoke/pvpoke",
    "commit": "5e1e3d971369a47aaf3e7247f50710d80205d570",
    "commit_date": "2026-07-26",
    "license": "MIT",
    "moves_path": "src/data/gamemaster/moves.json",
    "damage_calculator_path": "src/js/battle/DamageCalculator.js",
    "attribution_file": "knowledge/PVPOKE-LICENSE.txt"
  },
  "scope": {
    "battle_mode": "trainer-battle mechanics used as normalized Rocket planning inputs",
    "current_meta": false,
    "authored_rankings": false,
    "opponent_levels_or_moves": false,
    "exact_win_or_survivability_claims": false
  },
  "multipliers": {
    "same_type_attack_bonus": 1.2000000476837158,
    "super_effective": 1.600000023841858,
    "resisted": 0.625,
    "double_resisted": 0.390625,
    "shadow_attack_bonus": 1.2,
    "trainer_battle_bonus": 1.2999999523162842
  },
  "type_traits": {
    "bug": {
      "resistances": [
        "fighting",
        "ground",
        "grass"
      ],
      "weaknesses": [
        "flying",
        "rock",
        "fire"
      ],
      "immunities": []
    },
    "dark": {
      "resistances": [
        "ghost",
        "dark"
      ],
      "weaknesses": [
        "fighting",
        "fairy",
        "bug"
      ],
      "immunities": [
        "psychic"
      ]
    },
    "dragon": {
      "resistances": [
        "fire",
        "water",
        "grass",
        "electric"
      ],
      "weaknesses": [
        "dragon",
        "ice",
        "fairy"
      ],
      "immunities": []
    },
    "electric": {
      "resistances": [
        "flying",
        "steel",
        "electric"
      ],
      "weaknesses": [
        "ground"
      ],
      "immunities": []
    },
    "fairy": {
      "resistances": [
        "fighting",
        "bug",
        "dark"
      ],
      "weaknesses": [
        "poison",
        "steel"
      ],
      "immunities": [
        "dragon"
      ]
    },
    "fighting": {
      "resistances": [
        "rock",
        "bug",
        "dark"
      ],
      "weaknesses": [
        "flying",
        "psychic",
        "fairy"
      ],
      "immunities": []
    },
    "fire": {
      "resistances": [
        "bug",
        "steel",
        "fire",
        "grass",
        "ice",
        "fairy"
      ],
      "weaknesses": [
        "ground",
        "rock",
        "water"
      ],
      "immunities": []
    },
    "flying": {
      "resistances": [
        "fighting",
        "bug",
        "grass"
      ],
      "weaknesses": [
        "rock",
        "electric",
        "ice"
      ],
      "immunities": [
        "ground"
      ]
    },
    "ghost": {
      "resistances": [
        "poison",
        "bug"
      ],
      "weaknesses": [
        "ghost",
        "dark"
      ],
      "immunities": [
        "normal",
        "fighting"
      ]
    },
    "grass": {
      "resistances": [
        "ground",
        "water",
        "grass",
        "electric"
      ],
      "weaknesses": [
        "flying",
        "poison",
        "bug",
        "fire",
        "ice"
      ],
      "immunities": []
    },
    "ground": {
      "resistances": [
        "poison",
        "rock"
      ],
      "weaknesses": [
        "water",
        "grass",
        "ice"
      ],
      "immunities": [
        "electric"
      ]
    },
    "ice": {
      "resistances": [
        "ice"
      ],
      "weaknesses": [
        "fighting",
        "fire",
        "steel",
        "rock"
      ],
      "immunities": []
    },
    "normal": {
      "resistances": [],
      "weaknesses": [
        "fighting"
      ],
      "immunities": [
        "ghost"
      ]
    },
    "poison": {
      "resistances": [
        "fighting",
        "poison",
        "bug",
        "fairy",
        "grass"
      ],
      "weaknesses": [
        "ground",
        "psychic"
      ],
      "immunities": []
    },
    "psychic": {
      "resistances": [
        "fighting",
        "psychic"
      ],
      "weaknesses": [
        "bug",
        "ghost",
        "dark"
      ],
      "immunities": []
    },
    "rock": {
      "resistances": [
        "normal",
        "flying",
        "poison",
        "fire"
      ],
      "weaknesses": [
        "fighting",
        "ground",
        "steel",
        "water",
        "grass"
      ],
      "immunities": []
    },
    "steel": {
      "resistances": [
        "normal",
        "flying",
        "rock",
        "bug",
        "steel",
        "grass",
        "psychic",
        "ice",
        "dragon",
        "fairy"
      ],
      "weaknesses": [
        "fighting",
        "ground",
        "fire"
      ],
      "immunities": [
        "poison"
      ]
    },
    "water": {
      "resistances": [
        "steel",
        "fire",
        "water",
        "ice"
      ],
      "weaknesses": [
        "grass",
        "electric"
      ],
      "immunities": []
    }
  },
  "moves": [
    {
      "move_id": "ACID",
      "name": "Acid",
      "type": "poison",
      "power": 6.0,
      "energy": 0.0,
      "energy_gain": 8.0,
      "cooldown_ms": 1000,
      "turns": 2,
      "archetype": "Multipurpose"
    },
    {
      "move_id": "ACID_SPRAY",
      "name": "Acid Spray",
      "type": "poison",
      "power": 20.0,
      "energy": 45.0,
      "energy_gain": 0.0,
      "cooldown_ms": 500,
      "turns": 1,
      "archetype": "Debuff",
      "buffs": [
        0,
        -2
      ],
      "buff_target": "opponent",
      "buff_apply_chance": 1.0
    },
    {
      "move_id": "ACROBATICS",
      "name": "Acrobatics",
      "type": "flying",
      "power": 110.0,
      "energy": 55.0,
      "energy_gain": 0.0,
      "cooldown_ms": 500,
      "turns": 1,
      "archetype": "General"
    },
    {
      "move_id": "AEGISLASH_CHARGE_AIR_SLASH",
      "name": "Air Slash",
      "type": "flying",
      "power": 0.0,
      "energy": 0.0,
      "energy_gain": 6.0,
      "cooldown_ms": 1500,
      "turns": 3,
      "archetype": "Low Quality"
    },
    {
      "move_id": "AEGISLASH_CHARGE_PSYCHO_CUT",
      "name": "Psycho Cut",
      "type": "psychic",
      "power": 0.0,
      "energy": 0.0,
      "energy_gain": 6.0,
      "cooldown_ms": 1000,
      "turns": 2,
      "archetype": "Low Quality"
    },
    {
      "move_id": "AERIAL_ACE",
      "name": "Aerial Ace",
      "type": "flying",
      "power": 60.0,
      "energy": 45.0,
      "energy_gain": 0.0,
      "cooldown_ms": 500,
      "turns": 1,
      "archetype": "General"
    },
    {
      "move_id": "AEROBLAST",
      "name": "Aeroblast",
      "type": "flying",
      "power": 170.0,
      "energy": 75.0,
      "energy_gain": 0.0,
      "cooldown_ms": 500,
      "turns": 1,
      "archetype": "Boost Nuke",
      "buffs": [
        2,
        0
      ],
      "buff_target": "self",
      "buff_apply_chance": 0.125
    },
    {
      "move_id": "AIR_CUTTER",
      "name": "Air Cutter",
      "type": "flying",
      "power": 45.0,
      "energy": 35.0,
      "energy_gain": 0.0,
      "cooldown_ms": 500,
      "turns": 1,
      "archetype": "Boost Spam",
      "buffs": [
        1,
        0
      ],
      "buff_target": "self",
      "buff_apply_chance": 0.3
    },
    {
      "move_id": "AIR_SLASH",
      "name": "Air Slash",
      "type": "flying",
      "power": 9.0,
      "energy": 0.0,
      "energy_gain": 9.0,
      "cooldown_ms": 1500,
      "turns": 3,
      "archetype": "General"
    },
    {
      "move_id": "ANCIENT_POWER",
      "name": "Ancient Power",
      "type": "rock",
      "power": 60.0,
      "energy": 45.0,
      "energy_gain": 0.0,
      "cooldown_ms": 500,
      "turns": 1,
      "archetype": "Boost",
      "buffs": [
        1,
        1
      ],
      "buff_target": "self",
      "buff_apply_chance": 0.1
    },
    {
      "move_id": "AQUA_JET",
      "name": "Aqua Jet",
      "type": "water",
      "power": 70.0,
      "energy": 40.0,
      "energy_gain": 0.0,
      "cooldown_ms": 500,
      "turns": 1,
      "archetype": "General"
    },
    {
      "move_id": "AQUA_STEP",
      "name": "Aqua Step",
      "type": "water",
      "power": 55.0,
      "energy": 40.0,
      "energy_gain": 0.0,
      "cooldown_ms": 500,
      "turns": 1,
      "archetype": "Boost",
      "buffs": [
        1,
        0
      ],
      "buff_target": "self",
      "buff_apply_chance": 1.0
    },
    {
      "move_id": "AQUA_TAIL",
      "name": "Aqua Tail",
      "type": "water",
      "power": 55.0,
      "energy": 35.0,
      "energy_gain": 0.0,
      "cooldown_ms": 500,
      "turns": 1,
      "archetype": "Spam/Bait"
    },
    {
      "move_id": "ASTONISH",
      "name": "Astonish",
      "type": "ghost",
      "power": 12.0,
      "energy": 0.0,
      "energy_gain": 10.0,
      "cooldown_ms": 1500,
      "turns": 3,
      "archetype": "Multipurpose"
    },
    {
      "move_id": "AURA_SPHERE",
      "name": "Aura Sphere",
      "type": "fighting",
      "power": 80.0,
      "energy": 40.0,
      "energy_gain": 0.0,
      "cooldown_ms": 500,
      "turns": 1,
      "archetype": "Spam/Bait"
    },
    {
      "move_id": "AURA_WHEEL_DARK",
      "name": "Aura Wheel",
      "type": "dark",
      "power": 100.0,
      "energy": 45.0,
      "energy_gain": 0.0,
      "cooldown_ms": 500,
      "turns": 1,
      "archetype": "Boost",
      "buffs": [
        1,
        0
      ],
      "buff_target": "self",
      "buff_apply_chance": 1.0
    },
    {
      "move_id": "AURA_WHEEL_ELECTRIC",
      "name": "Aura Wheel",
      "type": "electric",
      "power": 100.0,
      "energy": 45.0,
      "energy_gain": 0.0,
      "cooldown_ms": 500,
      "turns": 1,
      "archetype": "Boost",
      "buffs": [
        1,
        0
      ],
      "buff_target": "self",
      "buff_apply_chance": 1.0
    },
    {
      "move_id": "AURORA_BEAM",
      "name": "Aurora Beam",
      "type": "ice",